{
  "editorial_pauses": [
    {
      "captions_suppressed": true,
      "duration_seconds": 4,
      "editorial_function": "Create a deliberate editorial breath for not someday. right now. while the licensed score carries the transition.",
      "emphasis": "NOT SOMEDAY. RIGHT NOW.",
      "eyebrow": "THE TIMELINE",
      "music_behavior": "rise_then_hold",
      "narrative_trigger": "After narration lands on: NOT SOMEDAY. RIGHT NOW.",
      "output_end_seconds": 62.466667,
      "output_start_seconds": 58.466667,
      "pause_id": "PAUSE_01",
      "pause_type": "warning_pivot",
      "source_time_seconds": 58.466667,
      "visual_behavior": "single_meaningful_hold"
    },
    {
      "captions_suppressed": true,
      "duration_seconds": 4,
      "editorial_function": "Create a deliberate editorial breath for a test. not an incident. while the licensed score carries the transition.",
      "emphasis": "A TEST. NOT AN INCIDENT.",
      "eyebrow": "THE LIMIT",
      "music_behavior": "rise_then_hold",
      "narrative_trigger": "After narration lands on: A TEST. NOT AN INCIDENT.",
      "output_end_seconds": 98.466667,
      "output_start_seconds": 94.466667,
      "pause_id": "PAUSE_02",
      "pause_type": "warning_pivot",
      "source_time_seconds": 90.466667,
      "visual_behavior": "single_meaningful_hold"
    },
    {
      "captions_suppressed": true,
      "duration_seconds": 5,
      "editorial_function": "Create a deliberate editorial breath for slow down — and lose? while the licensed score carries the transition.",
      "emphasis": "SLOW DOWN — AND LOSE?",
      "eyebrow": "THE INCENTIVE",
      "music_behavior": "sustain_under_silence",
      "narrative_trigger": "After narration lands on: SLOW DOWN — AND LOSE?",
      "output_end_seconds": 223.066667,
      "output_start_seconds": 218.066667,
      "pause_id": "PAUSE_03",
      "pause_type": "open_question",
      "source_time_seconds": 210.066667,
      "visual_behavior": "single_symbolic_hold"
    },
    {
      "captions_suppressed": true,
      "duration_seconds": 4,
      "editorial_function": "Create a deliberate editorial breath for the risk leaves the lab while the licensed score carries the transition.",
      "emphasis": "THE RISK LEAVES THE LAB",
      "eyebrow": "THE PIVOT",
      "music_behavior": "rise_then_hold",
      "narrative_trigger": "After narration lands on: THE RISK LEAVES THE LAB",
      "output_end_seconds": 316.533333,
      "output_start_seconds": 312.533333,
      "pause_id": "PAUSE_04",
      "pause_type": "warning_pivot",
      "source_time_seconds": 299.533333,
      "visual_behavior": "single_meaningful_hold"
    },
    {
      "captions_suppressed": true,
      "duration_seconds": 5,
      "editorial_function": "Create a deliberate editorial breath for who gets to decide? while the licensed score carries the transition.",
      "emphasis": "WHO GETS TO DECIDE?",
      "eyebrow": "THE POWER",
      "music_behavior": "sustain_under_silence",
      "narrative_trigger": "After narration lands on: WHO GETS TO DECIDE?",
      "output_end_seconds": 440.746667,
      "output_start_seconds": 435.746667,
      "pause_id": "PAUSE_05",
      "pause_type": "open_question",
      "source_time_seconds": 418.746667,
      "visual_behavior": "single_symbolic_hold"
    },
    {
      "captions_suppressed": true,
      "duration_seconds": 5,
      "editorial_function": "Create a deliberate editorial breath for open or closed? while the licensed score carries the transition.",
      "emphasis": "OPEN OR CLOSED?",
      "eyebrow": "THE TRADE-OFF",
      "music_behavior": "sustain_under_silence",
      "narrative_trigger": "After narration lands on: OPEN OR CLOSED?",
      "output_end_seconds": 568.833333,
      "output_start_seconds": 563.833333,
      "pause_id": "PAUSE_06",
      "pause_type": "open_question",
      "source_time_seconds": 541.833333,
      "visual_behavior": "single_symbolic_hold"
    },
    {
      "captions_suppressed": true,
      "duration_seconds": 5,
      "editorial_function": "Create a deliberate editorial breath for safety must be built while the licensed score carries the transition.",
      "emphasis": "SAFETY MUST BE BUILT",
      "eyebrow": "THE WORK",
      "music_behavior": "open_then_decay",
      "narrative_trigger": "After narration lands on: SAFETY MUST BE BUILT",
      "output_end_seconds": 684.566667,
      "output_start_seconds": 679.566667,
      "pause_id": "PAUSE_07",
      "pause_type": "resolution_pivot",
      "source_time_seconds": 652.566667,
      "visual_behavior": "single_meaningful_hold"
    },
    {
      "captions_suppressed": true,
      "duration_seconds": 6,
      "editorial_function": "Create a deliberate editorial breath for people, right now. while the licensed score carries the transition.",
      "emphasis": "PEOPLE, RIGHT NOW.",
      "eyebrow": "THE CHOICE",
      "music_behavior": "open_then_decay",
      "narrative_trigger": "After narration lands on: PEOPLE, RIGHT NOW.",
      "output_end_seconds": 753.933333,
      "output_start_seconds": 747.933333,
      "pause_id": "PAUSE_08",
      "pause_type": "resolution_pivot",
      "source_time_seconds": 715.933333,
      "visual_behavior": "single_meaningful_hold"
    }
  ],
  "project_id": "001-ai-race",
  "proof_boundary": {
    "final_word": "Competition",
    "frame": 5411,
    "paragraph_end": true,
    "seconds": 180.36666666666667,
    "sentence_end": true,
    "shot_boundary": true
  },
  "schema_version": "1.0",
  "source_audio": "assets/narration/narration_final.mp3",
  "source_audio_sha256": "414b8c522b6293f84b6c98dd59a3dcd094817fa8a3990a05df38f44c8ad201f1",
  "source_duration_seconds": 719.928,
  "transformed_duration_seconds": 757.9333333333333,
  "words": [
    {
      "output_end": 3.308333,
      "output_start": 0,
      "source_end": 3.308333,
      "source_start": 0,
      "text": "Labs"
    },
    {
      "output_end": 6.616667,
      "output_start": 3.308333,
      "source_end": 6.616667,
      "source_start": 3.308333,
      "text": "know"
    },
    {
      "output_end": 9.925,
      "output_start": 6.616667,
      "source_end": 9.925,
      "source_start": 6.616667,
      "text": "the"
    },
    {
      "output_end": 13.233333,
      "output_start": 9.925,
      "source_end": 13.233333,
      "source_start": 9.925,
      "text": "risk"
    },
    {
      "output_end": 16.433333,
      "output_start": 13.233333,
      "source_end": 16.433333,
      "source_start": 13.233333,
      "text": "A"
    },
    {
      "output_end": 19.633333,
      "output_start": 16.433333,
      "source_end": 19.633333,
      "source_start": 16.433333,
      "text": "rival"
    },
    {
      "output_end": 22.833333,
      "output_start": 19.633333,
      "source_end": 22.833333,
      "source_start": 19.633333,
      "text": "may"
    },
    {
      "output_end": 26.033333,
      "output_start": 22.833333,
      "source_end": 26.033333,
      "source_start": 22.833333,
      "text": "move"
    },
    {
      "output_end": 29.233333,
      "output_start": 26.033333,
      "source_end": 29.233333,
      "source_start": 26.033333,
      "text": "first"
    },
    {
      "output_end": 33.233333,
      "output_start": 29.233333,
      "source_end": 33.233333,
      "source_start": 29.233333,
      "text": "Fear"
    },
    {
      "output_end": 37.233333,
      "output_start": 33.233333,
      "source_end": 37.233333,
      "source_start": 33.233333,
      "text": "drives"
    },
    {
      "output_end": 41.233333,
      "output_start": 37.233333,
      "source_end": 41.233333,
      "source_start": 37.233333,
      "text": "the"
    },
    {
      "output_end": 45.233333,
      "output_start": 41.233333,
      "source_end": 45.233333,
      "source_start": 41.233333,
      "text": "race"
    },
    {
      "output_end": 48.541667,
      "output_start": 45.233333,
      "source_end": 48.541667,
      "source_start": 45.233333,
      "text": "The"
    },
    {
      "output_end": 51.85,
      "output_start": 48.541667,
      "source_end": 51.85,
      "source_start": 48.541667,
      "text": "evidence"
    },
    {
      "output_end": 55.158333,
      "output_start": 51.85,
      "source_end": 55.158333,
      "source_start": 51.85,
      "text": "is"
    },
    {
      "output_end": 62.466667,
      "output_start": 55.158333,
      "source_end": 58.466667,
      "source_start": 55.158333,
      "text": "visible"
    },
    {
      "output_end": 67.8,
      "output_start": 62.466667,
      "source_end": 63.8,
      "source_start": 58.466667,
      "text": "Tests"
    },
    {
      "output_end": 73.133333,
      "output_start": 67.8,
      "source_end": 69.133333,
      "source_start": 63.8,
      "text": "reveal"
    },
    {
      "output_end": 78.466667,
      "output_start": 73.133333,
      "source_end": 74.466667,
      "source_start": 69.133333,
      "text": "pressure"
    },
    {
      "output_end": 81.133333,
      "output_start": 78.466667,
      "source_end": 77.133333,
      "source_start": 74.466667,
      "text": "A"
    },
    {
      "output_end": 83.8,
      "output_start": 81.133333,
      "source_end": 79.8,
      "source_start": 77.133333,
      "text": "drill"
    },
    {
      "output_end": 86.466667,
      "output_start": 83.8,
      "source_end": 82.466667,
      "source_start": 79.8,
      "text": "is"
    },
    {
      "output_end": 89.133333,
      "output_start": 86.466667,
      "source_end": 85.133333,
      "source_start": 82.466667,
      "text": "not"
    },
    {
      "output_end": 91.8,
      "output_start": 89.133333,
      "source_end": 87.8,
      "source_start": 85.133333,
      "text": "an"
    },
    {
      "output_end": 98.466667,
      "output_start": 91.8,
      "source_end": 90.466667,
      "source_start": 87.8,
      "text": "incident"
    },
    {
      "output_end": 102.866667,
      "output_start": 98.466667,
      "source_end": 94.866667,